movie_id,title,description,filename
95,劇場版 名探偵コナン ベイカー街（ストリート）の亡霊,シャーロック・ホームズが活躍した100年前のロンドンに、コナンたちが迷い込む！？世界最高・仮想体感ゲーム「コクーン」に操られる50人の命。現実で起こったふたつの事件と、バーチャルゲームの中で起こる事件がリンクする中で父・優作と共に人工頭脳「ノアズ・アーク」に挑むコナン！コナンと参加者の少年たちが助け合いながら事件を解決してゆくジュブナイルミステリー。©2002 青山剛昌／小学館･読売テレビ･日本テレビ･小学館プロダクション･東宝･TMS,95.jpg
96,映画クレヨンしんちゃん　ヘンダーランドの大冒険,今度はテーマパークを舞台にしんちゃん大活躍！？ 　幼稚園の遠足で出かけた“群馬ヘンダーランド”。実はそのヘンダーランドこそオカマ魔女とその一味が地球征服を企む本拠地だった！ 　そこで地球のピンチに立ち上がったしんちゃん。お馴染みのアクション仮面、ぶりぶりざえもん、カンタム・ロボと強力な助っ人を引き連れて、オカマ魔女率いる強敵陣と世紀の大勝負!!当時セクシーアイドルとして大活躍した雛形あきこも登場。 　さあ、地球の運命はいったいどうなる！？ (C)臼井儀人／双葉社・シンエイ・テレビ朝日・ＡＤＫ　1996,96.jpg
97,映画ドラえもん 新・のび太と鉄人兵団,北極（ほっきょく）で、巨大（きょだい）なロボットの足を拾ったのび太。その後、次々とロボットの部品が家の庭に落ちてくる。ドラえもんとのび太は組み立てたロボットを「ザンダクロス」と名づけるが…。 (C)藤子プロ・小学館・テレビ朝日・シンエイ・ADK 2011,97.jpg
98,劇場版ポケットモンスター 水の都の護神 ラティアスとラティオス,世界で一番美しい町といわれる水の都「アルトマーレ」。そこでサトシは不思議な技を持つポケモン、ラティアスとラティオスに出会う。ラティオスは兄、ラティアスは妹でとても仲がよく、この町の秘宝「こころのしずく」を守っていた。この秘宝をねらう怪盗姉妹ザンナーとリオン。彼女たちが起こした事件に巻き込まれるサトシとピカチュウたち。隠された封印が解かれた時、町は大水害に見舞われる。奪われた「こころのしずく」を取り返す為、サトシとピカチュウが水の都を駆け抜ける！,98.jpg
99,君の名は。,千年ぶりとなる彗星の来訪を一か月後に控えた日本。山深い田舎町に暮らす女子高校生・三葉は憂鬱な毎日を過ごしていた。町長である父の選挙運動に、家系の神社の古き風習。小さく狭い町で、周囲の目が余計に気になる年頃だけに、都会への憧れを強くするばかり。「来世は東京のイケメン男子にしてくださーーーい！！！」そんなある日、自分が男の子になる夢を見る。見慣れない部屋、見知らぬ友人、戸惑いながらも、念願だった都会での生活を思いっきり満喫する三葉。「不思議な夢……。」一方、東京で暮らす男子高校生、瀧も、奇妙な夢を見た。行ったこともない山奥の町で、自分が女子高校生になっているのだー。彼らが体験した夢の秘密とは？,99.jpg
100,ぼくらの７日間戦争,いつもひとりで本ばかり読んでいる、鈴原守。話し相手といえば、同じ歴史マニアが集うチャットのメンバー。 平均年齢還暦越えと思われるその場所で、今日もメンバーの一人が、恋に悩む守にからかい半分のエールをくれた。 片思いの相手は、お隣に住む幼馴染の千代野綾。しかし綾は、議員である父親の都合で東京へ引っ越すことを迫られていた。 しかも、いきなり一週間後。「せめて、17歳の誕生日は、この街で迎えたかったな」。 やり場のない綾の本音を聞き、守は思い切って告げる。「逃げましょう・・・・・・っ！」,100.jpg
